{
  "$schema": "http://json-schema.org/draft-07/schema#",
  "$id": "https://aftermap.local/schemas/manifest.schema.json",
  "title": "MapPackManifest",
  "description": "Versioned map pack manifest. Authoritative contract for tools/map_pipeline (ADR-0006) and the Godot client (§11.17). Coordinates are coarse-grained to ~4 decimal minutes (~11 m) per ADR-0006 §8.",
  "type": "object",
  "required": [
    "city_id",
    "name",
    "version",
    "fingerprint",
    "content_fingerprint",
    "pois",
    "generated_at",
    "source",
    "license"
  ],
  "additionalProperties": false,
  "properties": {
    "city_id": {
      "type": "string",
      "pattern": "^[a-z0-9_]{3,40}$",
      "description": "Stable identifier for the city/preset. Lowercase ASCII."
    },
    "name": {
      "type": "string",
      "minLength": 1,
      "description": "Localised display name (original script retained)."
    },
    "version": {
      "type": "string",
      "pattern": "^\\d+\\.\\d+\\.\\d+$",
      "description": "Semantic version of the manifest contract this pack targets."
    },
    "fingerprint": {
      "type": "string",
      "pattern": "^[0-9a-f]{8,64}$",
      "description": "Deterministic short hash over the manifest body (excluding the content fingerprint itself)."
    },
    "content_fingerprint": {
      "type": "string",
      "pattern": "^[0-9a-f]{16,64}$",
      "description": "Hash over the embedded city graph + scenarios. Mirrors ADR-0004 content_fingerprint."
    },
    "pois": {
      "type": "array",
      "minItems": 1,
      "items": {
        "type": "object",
        "required": [
          "poi_id",
          "name",
          "class",
          "lat",
          "lon",
          "grid_w",
          "grid_h",
          "container_count"
        ],
        "additionalProperties": false,
        "properties": {
          "poi_id": {
            "type": "string",
            "pattern": "^poi_[a-z0-9_]+$"
          },
          "name": {
            "type": "string",
            "minLength": 1
          },
          "class": {
            "type": "string",
            "enum": [
              "pharmacy",
              "clinic",
              "grocery",
              "depot",
              "residence",
              "police",
              "school",
              "gas_station",
              "warehouse",
              "park",
              "industrial",
              "office"
            ],
            "description": "Mirrors §12.9.2 / poi-room.schema.json enum."
          },
          "lat": {
            "type": "number",
            "minimum": -90,
            "maximum": 90,
            "description": "Coarse-grained latitude in WGS-84 degrees. ADR-0006 §8 forbids precise private coordinates in shipped manifests."
          },
          "lon": {
            "type": "number",
            "minimum": -180,
            "maximum": 180,
            "description": "Coarse-grained longitude in WGS-84 degrees."
          },
          "grid_w": {
            "type": "integer",
            "minimum": 4,
            "maximum": 64
          },
          "grid_h": {
            "type": "integer",
            "minimum": 4,
            "maximum": 64
          },
          "container_count": {
            "type": "integer",
            "minimum": 0,
            "maximum": 32,
            "description": "Number of searchable containers at this POI."
          }
        }
      }
    },
    "generated_at": {
      "type": "string",
      "pattern": "^\\d{4}-\\d{2}-\\d{2}T\\d{2}:\\d{2}:\\d{2}Z$",
      "description": "ISO-8601 UTC timestamp with second precision."
    },
    "source": {
      "type": "string",
      "enum": ["preset-demo", "osm-snapshot"],
      "description": "Indicates whether the manifest wraps a hand-authored preset or an OSM-derived snapshot."
    },
    "license": {
      "type": "string",
      "enum": ["ODbL", "ODbL-1.0", "internal"],
      "description": "OSM data is ODbL; preset content is internal."
    }
  }
}
